{
  "as_of": "2026-07-02T21:00:00+00:00",
  "engine_version": "1.0",
  "input_hashes": {
    "engine:Runtime/NorthStar/daily_intelligence.py": "2a5b220c88cd6301cc4a86cfa1df000e5cf644c2abeb2ef04e59cea9b65f0152",
    "engine:Runtime/NorthStar/dashboard_binding.py": "3134156ac4136b7d3012cfad334c8e2d151c653711ef13797218bf12c3e30177",
    "engine:Runtime/NorthStar/shadow_quality.py": "593838a72d84f7b02ae8d21902c1dd724d4a8e9935e711ef29089f717e6c5aa3",
    "engine:Runtime/Providers/artifacts.py": "b8ce7f136df65b9065db7383b9d358a6760160bc6341691e9aeab8819d96273a",
    "engine:Runtime/Providers/base.py": "5fb3429955f83038863f716898ce32fc40181d3dc987ea90336d44b609c6a03b",
    "engine:Runtime/Providers/evidence.py": "090a8327cfd15fc163c0a0f31e224707a23411e950a34866393d098f7da49f92",
    "engine:Runtime/Providers/models.py": "0bd057ecd9b4bdef9518d1f895b795e77e79d58cd1bb84dd5d3fbe08f2a64281",
    "engine:Runtime/Providers/providers.py": "0b8cef5aad12ba6aa1636468dce6f381607d743a74749eda78bbe7702d74de30",
    "engine:Runtime/Providers/quality.py": "9595a2d6edfe5024a1732bbdaea0c9f414929cff243f6b9a7f10771b19c5fb25",
    "engine:Runtime/Providers/snapshot.py": "eabd5fb9fd78dfad63c4f3d23cf5d69988a2ad3990282ca2c5f2e7d982895b01",
    "engine:Scripts/Dashboard/build_dashboard_data.py": "3c7f204a85d2ff61b4a283e40f0cd26a10021022f0fbe9932829a995af195506",
    "engine:Scripts/Replay/shadow_data_replay.py": "c39904462fdedc1e20da73ad071d5801fca090d6cd011ef45cd131d77f4b4f05",
    "fixture": "435655868f8e4d346120a11e2fb03677b540d7de96b65c4561ea18b9dd827b11",
    "outcome": "a22584e9dc38c38aec9a1b6aa36d6beb391430dcf325c15593b454d0286ace20",
    "repository:Dashboard/app.js": "abc100aeda5bb0307277acbac96c15dc42ebf7571173c43fbab36b4548feacbc",
    "repository:Dashboard/index.html": "bff1a8018717bbedcb884361beddc4dc31a9a63dcca8e1015b6717648d9f7972",
    "repository:Dashboard/styles.css": "057ad48de28639036c13d2ab292246cdaa23d1af453fafd7dfaa11c863ce4a23",
    "repository:Data/KnowledgeGraph/EDGES.json": "9a96687537361b6c0aa1f6accb408b8d4ce947aa335eb65d94cdb847547c0756",
    "repository:Data/KnowledgeGraph/NODES.json": "89345eb83a63e33040982da91454fc2e11a1b90878f7255d14c02274986d1a11",
    "repository:Knowledge/Daily/2026/2026-06/2026-06-26/prediction.json": "0fc15f291ba988f9490ef27c6a72a462b1281ff993e97af4984e5f1dabf957a3",
    "repository:Knowledge/MarketMind/2026/2026-06/2026-06-26/market_mind.json": "d4c5ee0ff36463f5387cb23c3439e1b666b12a7353956c23188846b7351b0c6a",
    "repository:Runtime/Repository/index/validation_report.json": "17de981e1561daf31386f118945a864b0137ec47407b79b96d3bff10e2c4724b",
    "repository:Sandbox/Ingestion/processed/EV-101.md": "bd50a1f51e5dd32ff46d417b84f593ec3b9de83583abdecfe3dd35e18a6ffa23",
    "repository:Sandbox/Ingestion/processed/EV-102.md": "985c868504bfb79affb610e5468b0e1febcb63dab7497094f2b352a7442c0481",
    "repository:Sandbox/Ingestion/processed/EV-103.md": "82eecb042d3fcaa47bf85e71df326864474b00a64231443b3cfb81298a03defc",
    "repository:Sandbox/Ingestion/processed/EV-104.md": "3c0fd2a60ed93e4f265ef4fa4087f68068f2a9267bc23ce1d821c2d7a4a1c927",
    "repository:Sandbox/Ingestion/processed/EV-105.md": "883acfbbee58c750184f4fb493d80209cba54e61a8f3ad60ef33fb5586023d16",
    "repository:Sandbox/PatternDiscovery/candidates/PC-001.json": "b7cca67e0a2bfd897fc76f4b9f1f2cca6d590669e66f504bf8a8c985d0ad70fd",
    "repository:Sandbox/PatternDiscovery/candidates/PC-002.json": "791e3efc2edf8e687595500956bf0f984e54b2c5a6b22a10f0df667e2311ec13",
    "repository:Sandbox/PatternDiscovery/candidates/PC-003.json": "b91e3edb4d4c62bef3380cd404ecf05ba431c55024c5da3e5749d9d8fe32154c",
    "repository:Sandbox/PatternDiscovery/pattern_candidate_registry.json": "4e7816e47b9885c9e17a1be9a146f0c72844bbab33491c965cb7a3504d0a7054",
    "repository:Sandbox/Review/verified/VC-101.json": "91068659f9c558ed9c71a9bbaab526ef3cdd220bfaed0e3775917f5b10abad18",
    "repository:Sandbox/Review/verified/VC-102.json": "3c62a4b9cfd087993b3538541ed0a836069093e79e2351cbb4b197eca1c544f7",
    "repository:Sandbox/Review/verified/VC-103.json": "7e1f0330f3064732db01aebdfbb4ed228572093b0f9d19755902b5d204e6a68b",
    "repository:Sandbox/Review/verified/VC-104.json": "acb543db74cd6eb71fed1516ad3adee02a7956f6067edee7fddae821b88c8596",
    "repository:Sandbox/Review/verified/VC-105.json": "365e1ca5457279f848fbef5121331742f0ebb88f94f63f0e306cc523ef9f3ded",
    "repository:Sandbox/Review/verified_case_registry.json": "9c3119e8f2854fc897f492c16b1a48fb8b349bcd8e48f9b0ebddf1de489e2a2a",
    "shadow_input": "25d44166a26bd3fe826205a89584bc739b6f5bde5c3e631a7bb4126bd9bfc8fd"
  },
  "output_hashes": {
    "dashboard_app": "12500ea1ef5c87f1ca63f89b8cd819dbaac14af200b498b9a762e7f6ca790631",
    "dashboard_css": "909cddcdcb00438cdece01ae60929406ba6dda6e4e47dc9cb8a38158869aba17",
    "dashboard_html": "500c840ec3b10522171d14614b78fb3104fdcc7b178a8a553ef683b348004fb0",
    "dashboard_js": "c8972f5fe2447581a916b61cd7703c0674bfeeda6f4bbec2e063a924db7dd789",
    "dashboard_json": "92ca1462733df715fcc042eaa4ab6055ad022634f7a9490bbfcd873464f94297",
    "decision_snapshot": "ed2ffb45567e0e7c3d14bc86c1e8460d92469e6facc594a4405fe021a64266d7",
    "evidence": "df8ec57f10321106900a83f0042978c931337ea467f0e208a869afcd1c1802b0",
    "market_snapshot": "cf88d77d9ebae723bc13c0055bb203ae5f4c900e288f44918e62b0d2c8c42fa0",
    "outcome": "d997346f5867c90ab5db851404a4d0a1f6372aef7429c04ff1c60877b711b345",
    "reflection": "a03d52aa1c0c33b6b08aab4078dbd2ce6a5e8edc3827b0276f3490f408574d54",
    "residual": "34cbdfa274ee62bdf12ca27f58c0fc7d4e64541e9c6d676861869c3a52c28c92",
    "root_cause": "4a818d57b10aeb4ce422855b0965e26e71e7a5e7329400c9a5fdd74788614815"
  },
  "production_authorized": false,
  "replay_date": "2026-07-02",
  "replay_id": "SHADOW-REPLAY-20260702",
  "repository_baseline": "ec19fe35b3eadedfae99565ffd126433cdcffd6f",
  "repository_write_authorized": false,
  "reproducibility_digest": "809dc01e25a02641f5e93e0e18600a9ac7c02dac676cf0e4e4dc90fb0a0219cb",
  "runtime_api_access": false,
  "scoring_change": false,
  "status": "replay_complete",
  "strategy_change": false,
  "trading_signal": false
}
